{
	"name": "Fastify Server",
	"description": "Template for generating a Fastify server",
	"type": "server",
	"template": [
		"import Fastify from 'fastify';",
		"import cors from '@fastify/cors';",
		"",
		"const fastify = Fastify({ logger: true });",
		"const requestedPort = Number(process.env.PORT ?? 3000);",
		"const port = Number.isNaN(requestedPort) ? 3000 : requestedPort;",
		"const host = process.env.HOST ?? '0.0.0.0';",
		"",
		"fastify.register(cors);",
		"",
		"fastify.get('/health', async () => ({ status: 'ok' }));",
		"",
		"async function start(): Promise<void> {",
		"  try {",
		"    await fastify.listen({ port, host });",
		"  } catch (error: unknown) {",
		"    const message = error instanceof Error ? error.message : 'Unexpected server error';",
		"    fastify.log.error(message);",
		"    process.exit(1);",
		"  }",
		"}",
		"",
		"void start();"
	]
}
