{
	"name": "Function Template",
	"description": "Template for generating a TypeScript function",
	"type": "function",
	"template": [
		"/**",
		" * Formats a value into a consistent label.",
		" */",
		"export function {{fileNameCamelCase}}(value: string): string {",
		"  const normalizedValue = value.trim();",
		"",
		"  if (!normalizedValue) {",
		"    throw new Error('Value is required');",
		"  }",
		"",
		"  return normalizedValue.replace(/\\s+/g, ' ');",
		"}"
	]
}
